{
  "$schema": "./enums.schema.json",
  "contract": "optomstroy-pos-enums",
  "version": "1.2.0",
  "basis": {
    "kernel": "docs/research/R0_DECISION_KERNEL.md v1.9 (§6, §7, §17.3, §17.4, §18.1, §18.2, §22, §23 п.5, §24)",
    "dbEnums": "docs/specification/07_DATA_MODEL.md §6.1 (владелец enum-ов, ядро §18.1)",
    "checkLists": "docs/specification/07_DATA_MODEL.md §6.1.1 (владелец CHECK-перечней, ядро §18.1)",
    "problemCodes": "docs/specification/08_API_SPECIFICATION.md §2.4 (владелец словаря кодов ошибок, ядро §18.1)",
    "syncErrorCodes": "docs/specification/08_API_SPECIFICATION.md §2.4, абзац «Коды журнала синхронизации» (ядро §18.1, §18.2 п.10)",
    "apiEnums": "docs/specification/08_API_SPECIFICATION.md §2.4, §3.8; ядро §23 п.5"
  },
  "dbEnums": [
    {
      "name": "user_kind",
      "values": [
        "staff",
        "customer"
      ],
      "source": "ядро §6",
      "usage": "users.kind"
    },
    {
      "name": "user_status",
      "values": [
        "pending",
        "pending_activation",
        "active",
        "blocked",
        "deleted"
      ],
      "source": "ядро §6",
      "usage": "users.status"
    },
    {
      "name": "role_code",
      "values": [
        "seller",
        "cashier",
        "senior_seller",
        "admin",
        "owner",
        "customer",
        "integration"
      ],
      "source": "ядро §6",
      "usage": "roles.code, user_invitations.role, role_discount_limits.role, price_lists.visible_to_roles[], audit_logs.actor_role"
    },
    {
      "name": "customer_link_status",
      "values": [
        "proposed",
        "confirmed",
        "rejected",
        "conflict"
      ],
      "source": "ядро §6",
      "usage": "customer_links.status"
    },
    {
      "name": "cart_status",
      "values": [
        "active",
        "parked",
        "converted",
        "cleared"
      ],
      "source": "ядро §6",
      "usage": "carts.status"
    },
    {
      "name": "order_status",
      "values": [
        "draft",
        "submitting",
        "submit_failed",
        "pending_approval",
        "awaiting_payment",
        "approved",
        "awaiting_shipment",
        "shipped",
        "partially_returned",
        "closed",
        "cancelled"
      ],
      "source": "D-20",
      "usage": "orders.status, order_status_history.from_status/to_status"
    },
    {
      "name": "delivery_method",
      "values": [
        "pickup",
        "delivery"
      ],
      "source": "ядро §6",
      "usage": "orders.delivery_method"
    },
    {
      "name": "receiver_kind",
      "values": [
        "customer",
        "other_person"
      ],
      "source": "ядро §6",
      "usage": "orders.receiver_kind"
    },
    {
      "name": "payment_method",
      "values": [
        "cash",
        "qr_bakai",
        "credit"
      ],
      "source": "ядро §6",
      "usage": "orders.payment_method, payments.method, transactions.payment_method, return_requests.refund_method_expected"
    },
    {
      "name": "payment_status",
      "values": [
        "initiated",
        "cash_pending",
        "qr_pending",
        "qr_shown",
        "qr_expired",
        "manual_confirm",
        "credit",
        "received",
        "voided",
        "refunded"
      ],
      "source": "D-21",
      "usage": "payments.status"
    },
    {
      "name": "return_request_status",
      "values": [
        "draft",
        "submitted",
        "accepted",
        "rejected",
        "completed"
      ],
      "source": "ядро §6",
      "usage": "return_requests.status"
    },
    {
      "name": "transaction_kind",
      "values": [
        "order_created",
        "order_cancelled",
        "payment_received",
        "payment_voided",
        "refund",
        "discount_override",
        "credit_sale_approved",
        "manual_qr_confirm",
        "return_requested"
      ],
      "source": "ядро §6 + §17.3, §18.2 п.10 (return_requested — could)",
      "usage": "transactions.kind"
    },
    {
      "name": "sync_entity",
      "values": [
        "categories",
        "products",
        "variants",
        "attributes",
        "units",
        "barcodes",
        "images",
        "warehouses",
        "stock",
        "prices",
        "customers",
        "receivables",
        "sales_history",
        "order_status",
        "discounts",
        "payment_docs",
        "return_docs"
      ],
      "source": "ядро §6 + §17.3",
      "usage": "sync_runs.entity, sync_state.entity, sync_errors.entity, sync_entity_versions.entity"
    },
    {
      "name": "sync_mode",
      "values": [
        "full",
        "incremental",
        "manual",
        "reconcile"
      ],
      "source": "ядро §6",
      "usage": "sync_runs.mode"
    },
    {
      "name": "sync_run_status",
      "values": [
        "queued",
        "running",
        "success",
        "partial",
        "failed"
      ],
      "source": "ядро §6",
      "usage": "sync_runs.status"
    },
    {
      "name": "outbox_status",
      "values": [
        "pending",
        "sending",
        "sent",
        "confirmed",
        "failed",
        "dead",
        "cancelled"
      ],
      "source": "ядро §6 + v1.7 §22.1 (cancelled)",
      "usage": "onec_outbox.status; автомат — §6.5"
    },
    {
      "name": "notification_kind",
      "values": [
        "sync_error",
        "order_status",
        "cart_price_changed",
        "cart_stock_changed",
        "credit_blocked",
        "system",
        "payment_status",
        "return_status"
      ],
      "source": "ядро §6 + §17.3",
      "usage": "notifications.kind"
    },
    {
      "name": "invitation_status",
      "values": [
        "pending",
        "accepted",
        "revoked",
        "expired"
      ],
      "source": "РЕШЕНИЕ: ядро §17.3; карточка §5.3",
      "usage": "user_invitations.status"
    },
    {
      "name": "device_platform",
      "values": [
        "android",
        "ios",
        "windows"
      ],
      "source": "РЕШЕНИЕ: ядро §17.3; карточка §5.8",
      "usage": "devices.platform"
    },
    {
      "name": "session_kind",
      "values": [
        "standard",
        "biometric"
      ],
      "source": "РЕШЕНИЕ: ядро §17.3; карточка §5.9, R6 §2.2",
      "usage": "sessions.kind"
    },
    {
      "name": "step_up_method",
      "values": [
        "pin",
        "biometric",
        "otp"
      ],
      "source": "РЕШЕНИЕ: ядро §17.3; карточка §5.9",
      "usage": "sessions.step_up_method, audit_logs.step_up_method"
    },
    {
      "name": "otp_purpose",
      "values": [
        "login_or_register",
        "step_up",
        "phone_change_old",
        "phone_change_new",
        "customer_link"
      ],
      "source": "РЕШЕНИЕ: ядро §17.3, §18.2 п.7; карточка §5.11",
      "usage": "otp_challenges.purpose; тело POST /auth/otp/request (08)",
      "notUsed": [
        "login"
      ]
    },
    {
      "name": "otp_status",
      "values": [
        "sent",
        "verified",
        "expired",
        "locked",
        "failed_delivery",
        "superseded"
      ],
      "source": "РЕШЕНИЕ: ядро §17.3; карточка §5.11",
      "usage": "otp_challenges.status"
    },
    {
      "name": "consent_kind",
      "values": [
        "personal_data",
        "sms",
        "biometrics_device",
        "activity_sphere",
        "face_scan"
      ],
      "source": "РЕШЕНИЕ: ядро §17.3, §19.3; карточка §5.14",
      "usage": "consents.kind; DTO consents[].kind в POST /registration/complete (08)"
    },
    {
      "name": "attribute_value_type",
      "values": [
        "text",
        "number",
        "boolean",
        "list"
      ],
      "source": "РЕШЕНИЕ: ядро §17.3; карточка §5.18",
      "usage": "product_attributes.value_type"
    },
    {
      "name": "barcode_type",
      "values": [
        "EAN13",
        "EAN8",
        "UPC",
        "CODE128",
        "CODE39",
        "QR",
        "other"
      ],
      "source": "РЕШЕНИЕ: ядро §17.3; карточка §5.22",
      "usage": "barcodes.type"
    },
    {
      "name": "image_status",
      "values": [
        "pending",
        "downloading",
        "ready",
        "failed",
        "missing_source"
      ],
      "source": "РЕШЕНИЕ: ядро §17.3; карточка §5.23",
      "usage": "product_images.status"
    },
    {
      "name": "customer_source",
      "values": [
        "onec",
        "pos"
      ],
      "source": "РЕШЕНИЕ: ядро §17.3; карточка §5.28",
      "usage": "customers.source"
    },
    {
      "name": "customer_type",
      "values": [
        "individual",
        "entrepreneur",
        "legal"
      ],
      "source": "РЕШЕНИЕ: ядро §17.3, §19.4; карточка §5.28",
      "usage": "customers.customer_type"
    },
    {
      "name": "customer_onec_status",
      "values": [
        "n_a",
        "pending",
        "confirmed",
        "rejected",
        "duplicate"
      ],
      "source": "РЕШЕНИЕ: ядро §17.3; карточка §5.28",
      "usage": "customers.onec_status"
    },
    {
      "name": "contact_kind",
      "values": [
        "phone",
        "address",
        "email",
        "other"
      ],
      "source": "РЕШЕНИЕ: ядро §17.3; карточка §5.29",
      "usage": "customer_contacts.kind"
    },
    {
      "name": "link_match_method",
      "values": [
        "phone",
        "manual_admin",
        "onec_created"
      ],
      "source": "РЕШЕНИЕ: ядро §17.3; карточка §5.30",
      "usage": "customer_links.match_method"
    },
    {
      "name": "discount_source",
      "values": [
        "onec",
        "pos"
      ],
      "source": "РЕШЕНИЕ: ядро §17.3; карточка §5.33",
      "usage": "discount_rules.source"
    },
    {
      "name": "discount_kind",
      "values": [
        "percent",
        "fixed_amount",
        "price_list"
      ],
      "source": "РЕШЕНИЕ: ядро §17.3; карточка §5.33",
      "usage": "discount_rules.kind"
    },
    {
      "name": "status_change_source",